;Texto;Valor
5;CIRO FOI DIVULGAR O PRÓPRIO LIVRO E DISSE QUE TEM GENTE JÁ COLOCANDO PRA BAIXAR DE GRAÇA NA INTERNET DEFENSOR DA PIRATARIA DO PRÓPRIO LIVRO, NÃO TEM COMO NÃO VOTAR NESSE CARA MITADA DO PRESIDENTE CIRO GOMES;1
6;Sinceramente: nunca vi um presidente levar em público um esporro tão escandaloso. Sem que que seu nome tenha sido citado.  Mas foi pra ele.;1
7;Candidato pra mim tem que ser guerreiro como o @PastorLiomar que realmente se expõe e luta muito por um Brasil melhor. Esses candidatos que tem por aí que não fazem nada e só aparecem a cada 4 anos, pedindo seu voto,tentando a reeleição,esses pra mim não servem...;1
8;Ô @AttuchLeonardo , o Presidente veio jantar agora. Vai mentir novamente que ele foi expulso? A realidade é que vocês perderam as ruas, as redes, os corações e as mentes dos brasileiros. O Presidente tem o respeito da maior parte do povo que o admira e respeita.;1
9;Tem uma galera que está achando graça a gente comemorar que está pontuando na primeira pesquisa no início das eleições e não tem ideia do que é fazer uma campanha só com trabalho militante, sem fundo partidário, sem profissionalizar todos os setores.;1
10;Democracia não é só o voto, mas tudo que envolve a escolha dele, inclusive os debates, o candidato que não vai a debates não tem respeito pela democracia.;1
